{
  "schema_version": 1,
  "asset_kind": "frozen_baselines",
  "acceptance": {
    "unit": "pull_request",
    "base_ref": "develop",
    "prior_state": "event.pull_request.base.sha",
    "posterior_state": "checkout_head",
    "parent_check": {
      "first": "base.sha",
      "second": "head.sha"
    },
    "acceptance_id_source": "repository_and_pr_number",
    "self_reference": "none"
  },
  "movement_rules": {
    "triggers": [
      "value_change",
      "replacement",
      "addition",
      "removal",
      "location_change",
      "first_placement",
      "rule_self_change"
    ],
    "universal_lower_bound": [
      "set",
      "value",
      "placement",
      "target_correspondence",
      "identity_interpretation"
    ],
    "additional_targets": {},
    "self_change": {
      "trigger": "rule_self_change",
      "targets": [
        "*"
      ]
    }
  },
  "implementation_bindings": {
    "code_assets": [
      {
        "path": "scripts/check_frozen_baselines.py",
        "sha256": "2d45de24d8d2e48444ee2d0d43a66f13bf1f1146b940f5ba15f67ed9922cc6b9"
      },
      {
        "path": "scripts/frozen_baselines.py",
        "sha256": "8277e009a045768e2a0c7b08acba06782d7da2a02c69631b814940d09366da7c"
      }
    ],
    "strategy_keys": [
      "literal_commit_string/json_pointer_value"
    ],
    "registry": {
      "path": "scripts/frozen_baselines.py",
      "symbol": "COMPARISON_STRATEGIES"
    }
  },
  "placements": {
    "oracle_input": [
      {
        "kind": "ledger_series",
        "path": "contracts/authz/frozen-baselines.json",
        "series": "oracle_input"
      }
    ]
  },
  "declarations": {
    "oracle_input": {
      "frozen_targets": [
        "contracts/authz/oracle-seal.lock.json#/oracle_commit",
        "contracts/authz/attack-tree.json#/oracle_context/oracle_commit",
        "contracts/authz/boundary-proposal.json#/oracle_context/oracle_commit",
        "contracts/authz/claim-mutant-map.json#/oracle_context/oracle_commit",
        "contracts/authz/ddl-elements.json#/oracle_context/oracle_commit",
        "contracts/authz/rejected-configs.json#/oracle_context/oracle_commit",
        "contracts/authz/verification-evidence.json#/oracle_context/oracle_commit"
      ],
      "identity": "literal_commit_string",
      "granularity": "json_pointer_value",
      "basis_series": "oracle_input"
    }
  },
  "history": [
    {
      "acceptance_id": "masaki1025/pitchlog#73",
      "series": "oracle_input",
      "new_identity": {
        "present": true,
        "values": [
          {
            "kind": "literal_commit_string",
            "value": "24ef4fcc682b42b504edc1d6264d380760c54929"
          }
        ]
      },
      "prior_identity": {
        "present": true,
        "values": [
          {
            "kind": "literal_commit_string",
            "value": "24ef4fcc682b42b504edc1d6264d380760c54929"
          }
        ]
      },
      "changes": [
        {
          "aspect": "frozen_targets",
          "before": {
            "absent": true
          },
          "after": [
            "contracts/authz/oracle-seal.lock.json#/oracle_commit",
            "contracts/authz/attack-tree.json#/oracle_context/oracle_commit",
            "contracts/authz/boundary-proposal.json#/oracle_context/oracle_commit",
            "contracts/authz/claim-mutant-map.json#/oracle_context/oracle_commit",
            "contracts/authz/ddl-elements.json#/oracle_context/oracle_commit",
            "contracts/authz/rejected-configs.json#/oracle_context/oracle_commit",
            "contracts/authz/verification-evidence.json#/oracle_context/oracle_commit"
          ]
        },
        {
          "aspect": "identity",
          "before": {
            "absent": true
          },
          "after": "literal_commit_string"
        },
        {
          "aspect": "granularity",
          "before": {
            "absent": true
          },
          "after": "json_pointer_value"
        }
      ],
      "placement_change": {
        "before": [
          {
            "kind": "python_assignment",
            "path": "scripts/check_authz_catalog.py",
            "symbol": "ORACLE_INPUT_BASELINE_COMMIT"
          }
        ],
        "after": [
          {
            "kind": "ledger_series",
            "path": "contracts/authz/frozen-baselines.json",
            "series": "oracle_input"
          }
        ]
      },
      "moved": true,
      "reason": "凍結基準を検査器の直書き定数から台帳系列へ移設するため",
      "approved_by": "山田正輝",
      "approved_at": "2026-09-21"
    },
    {
      "acceptance_id": "masaki1025/pitchlog#77",
      "series": "oracle_input",
      "new_identity": {
        "present": true,
        "values": [
          {
            "kind": "literal_commit_string",
            "value": "70621e330610f214416aa7a1b067acf7b941f8c0"
          }
        ]
      },
      "prior_identity": {
        "present": true,
        "values": [
          {
            "kind": "literal_commit_string",
            "value": "24ef4fcc682b42b504edc1d6264d380760c54929"
          }
        ]
      },
      "changes": [
        {
          "aspect": "implementation_bindings",
          "before": {
            "code_assets": [
              {
                "path": "scripts/check_frozen_baselines.py",
                "sha256": "92f84bfbcf3167a844e4217cf3acb419b195cf78083985cb346a93b0a4857332"
              },
              {
                "path": "scripts/frozen_baselines.py",
                "sha256": "8277e009a045768e2a0c7b08acba06782d7da2a02c69631b814940d09366da7c"
              }
            ],
            "strategy_keys": [
              "literal_commit_string/json_pointer_value"
            ],
            "registry": {
              "path": "scripts/frozen_baselines.py",
              "symbol": "COMPARISON_STRATEGIES"
            }
          },
          "after": {
            "code_assets": [
              {
                "path": "scripts/check_frozen_baselines.py",
                "sha256": "2d45de24d8d2e48444ee2d0d43a66f13bf1f1146b940f5ba15f67ed9922cc6b9"
              },
              {
                "path": "scripts/frozen_baselines.py",
                "sha256": "8277e009a045768e2a0c7b08acba06782d7da2a02c69631b814940d09366da7c"
              }
            ],
            "strategy_keys": [
              "literal_commit_string/json_pointer_value"
            ],
            "registry": {
              "path": "scripts/frozen_baselines.py",
              "symbol": "COMPARISON_STRATEGIES"
            }
          }
        }
      ],
      "placement_change": {
        "before": [
          {
            "kind": "ledger_series",
            "path": "contracts/authz/frozen-baselines.json",
            "series": "oracle_input"
          }
        ],
        "after": [
          {
            "kind": "ledger_series",
            "path": "contracts/authz/frozen-baselines.json",
            "series": "oracle_input"
          }
        ]
      },
      "moved": false,
      "reason": "TSK-446 で route_kind へ record_and_aggregate を足したため、oracle 入力資産 route-registry.json と auth-catalog.json の内容が変わり、入力 baseline の commit を更新する必要があるため。承認の取得元: 2026-09-25 の Claude Code セッションでの発話(逐語「承認するから入れてくれない?」)。PR masaki1025/pitchlog#77 には本記録の時点で review・comment がいずれも 0 件であり、GitHub 側の機械可読な承認記録は存在しない",
      "approved_by": "山田正輝",
      "approved_at": "2026-09-25"
    },
    {
      "acceptance_id": "masaki1025/pitchlog#81",
      "series": "oracle_input",
      "new_identity": {
        "present": true,
        "values": [
          {
            "kind": "literal_commit_string",
            "value": "1f32e12a8c0e8acc66df448a22fc166be4643a3f"
          }
        ]
      },
      "prior_identity": {
        "present": true,
        "values": [
          {
            "kind": "literal_commit_string",
            "value": "70621e330610f214416aa7a1b067acf7b941f8c0"
          }
        ]
      },
      "changes": [],
      "placement_change": {
        "before": [
          {
            "kind": "ledger_series",
            "path": "contracts/authz/frozen-baselines.json",
            "series": "oracle_input"
          }
        ],
        "after": [
          {
            "kind": "ledger_series",
            "path": "contracts/authz/frozen-baselines.json",
            "series": "oracle_input"
          }
        ]
      },
      "moved": false,
      "reason": "develop 取り込み後の認可 oracle 入力8資産を第1段コミットへ再封印するため",
      "approved_by": "未承認(PR #81 のレビュー待ち)",
      "approved_at": "2026-10-05"
    },
    {
      "acceptance_id": "masaki1025/pitchlog#95",
      "series": "oracle_input",
      "new_identity": {
        "present": true,
        "values": [
          {
            "kind": "literal_commit_string",
            "value": "cc949c690a7da6d7e719561f9fa02153e1857610"
          }
        ]
      },
      "prior_identity": {
        "present": true,
        "values": [
          {
            "kind": "literal_commit_string",
            "value": "1f32e12a8c0e8acc66df448a22fc166be4643a3f"
          }
        ]
      },
      "changes": [],
      "placement_change": {
        "before": [
          {
            "kind": "ledger_series",
            "path": "contracts/authz/frozen-baselines.json",
            "series": "oracle_input"
          }
        ],
        "after": [
          {
            "kind": "ledger_series",
            "path": "contracts/authz/frozen-baselines.json",
            "series": "oracle_input"
          }
        ]
      },
      "moved": false,
      "reason": "U-M1(TSK-393)で record_and_aggregate 経路 6 本を #81 の認可 oracle 入力を含む base に重ねて route-registry.json と http-route-matrix.json に登録し、oracle 入力 blob が変わったため oracle_commit を更新する",
      "approved_by": "山田正輝",
      "approved_at": "2026-10-09"
    },
    {
      "acceptance_id": "masaki1025/pitchlog#128",
      "series": "oracle_input",
      "new_identity": {
        "present": true,
        "values": [
          {
            "kind": "literal_commit_string",